"nome","nota","ranked","synopsis"
"Usagi Drop Specials","8.03","Ranked #546","Four short episodes bundled with DVD/Blu-Ray.
Vol.1: Episode 2.5 ""Aquarium of Leaves""
Vol.2: Episode 3.5 ""Dear My Santa Claus""
Vol.3: Episode 6.5 ""Full Blossom in the Sky""
Vol.4: Episode 8.5 ""Way Home"""
"Ushio to Tora (TV) 2nd Season","8.03","Ranked #547","Continuation of Ushio to Tora TV series."
"Azumanga Daioh","8.02","Ranked #548","Chiyo Mihama begins her high school career as one of the strangest students in her freshman class—a tiny, 10-year-old academic prodigy with a fondness for plush dolls and homemade cooking. But her homeroom teacher, Yukari Tanizaki, is the kind of person who would hijack a student's bike to avoid being late, so ""strange"" is a relative word.

There certainly isn't a shortage of peculiar girls in Yukari-sensei's homeroom class. Accompanying Chiyo are students like Tomo Takino, an energetic tomboy with more enthusiasm than brains; Koyomi Mizuhara, Tomo's best friend whose temper has a fuse shorter than Chiyo; and Sakaki, a tall, athletic beauty whose intimidating looks hide a gentle personality and a painful obsession with cats. In addition, transfer student Ayumu Kasuga, a girl with her head stuck in the clouds, fits right in with the rest of the girls—and she has a few interesting theories about Chiyo's pigtails!

Together, this lovable group of girls experience the ups and downs of school life, their many adventures filled with constant laughter, surreal absurdity, and occasionally even touching commentary on the bittersweet, temporal nature of high school.

"
"Berserk: Ougon Jidai-hen II - Doldrey Kouryaku","8.02","Ranked #549","The Band of the Hawk and their enigmatic leader Griffith continue winning battle after battle as their prestige throughout the kingdom of Midland grows. But their latest task is one that has seen failure from everyone who has attempted it: the subjugation of the impenetrable fortress of Doldrey. 

But with members like Guts—the captain of the Hawks' raiders who can easily fell 100 men with his gigantic sword—such tasks prove to be trivial. However, in the aftermath of the battle, Guts decides to leave the Hawks in order to pursue his own dream and bids farewell to his companions, despite Griffith's attempts to make him stay. This single event causes Griffith to lose his composure, and leads him to make a decision that will alter his and the Hawks' fates forever.

"
"Cardcaptor Sakura: Clear Card-hen Prologue - Sakura to Futatsu no Kuma","8.02","Ranked #550","After the conclusion of the Sakura Card Arc, life is going back to normal. There are no more mysteries, no more disturbances of evil, no more tests of strength. Everyone is moving on with their lives and Sakura feels a sadness in her heart. Even through the goodbyes, Sakura perseveres to keep everyone and a special someone, dear to her heart."
"Drifters","8.02","Ranked #551","At the Battle of Sekigahara in 1600, Toyohisa Shimazu is the rearguard for his retreating troops, and is critically wounded when he suddenly finds himself in a modern, gleaming white hallway. Faced with only a stoic man named Murasaki and hundreds of doors on both sides, Toyohisa is pulled into the nearest door and into a world completely unlike his own.

The strange land is populated by all manner of fantastical creatures, as well as warriors from different eras of Toyohisa's world who were thought to be dead. Quickly befriending the infamous warlord Nobunaga Oda and the ancient archer Yoichi Suketaka Nasu, Toyohisa learns of the political unrest tearing through the continent. Furthermore, they have been summoned as ""Drifters"" to fight against the ""Ends,"" people who are responsible for the creation of the Orte Empire and are trying to annihilate the Drifters. As the Ends grow more powerful, so does the Empire's persecution of elves and other demihumans. It is up to Toyohisa and his group of unconventional heroes to battle in a brand-new world war to help the Empire's subjects, while protecting the land to claim for themselves and challenging the Ends.

"
"ef: A Tale of Memories.","8.02","Ranked #552","On Christmas Eve, Hiro Hirono runs into Miyako Miyamura, a frivolous girl who ""borrows"" his bicycle in order to chase down a purse thief. After Hiro finds his bicycle wrecked and Miyako unconscious, the two unexpectedly spend their Christmas Eve together, and when they discover they go to the same high school, their accidental relationship develops even further. This sparks the jealousy of Hiro's childhood friend Kei Shindou, whose pure approach to life catches the eye of Kyosuke Tsutsumi, a womanizing photographer searching for the perfect shot.

Elsewhere, Renji Asou, a boy who dreams of being a girl's knight in shining armor, has a chance encounter with Kei's twin sister—the overly shy Chihiro Shindou, who spends her time reading alone—at an abandoned train station. The two quickly become friends and eventually decide to write a novel together. However, when Renji discovers Chihiro's secret, a disability that causes her to have an eternally ephemeral memory, his childish ideals will be put to the test.

Guided by two mysterious adults, these youths' relationships intertwine in a heart-rending tale of love, rejection, acceptance, and memories.

"
"Grisaia no Meikyuu: Caprice no Mayu 0","8.02","Ranked #553","Having attended Mihama Academy for about a year, Yuuji Kazami has seemingly found his place within the school, but he suddenly decides to pursue a promotion in CIRS. After consulting JB about his intentions, they both thoroughly examine Yuuji's documents and dissect the events of his upbringing to determine if the job is fit for him.

Meanwhile, unbeknownst to the two, the girls of Mihama uncover some torn documents in Yuuji's room. After restoring the papers, they discover the story that has formed—or perhaps broken—Yuuji into the man he is today. However, what was thought to be history has haunted him to the present, and the chains of the past begin to drag him back into the darkness...

 
"
"Hibike! Euphonium","8.02","Ranked #554","After swearing off music due to an incident at the middle school regional concert band competition, euphonist Kumiko Oumae enters high school hoping for a fresh start. As fate would have it, she ends up being surrounded by people with an interest in the high school brass band. Kumiko finds the motivation she needs to make music once more with the help of her bandmates, some of whom are new like novice tubist Hazuki Katou; veteran contrabassist Sapphire Kawashima; and band vice president and fellow euphonist Asuka Tanaka. Others are old friends, like Kumiko's childhood friend and hornist-turned-trombonist Shuuichi Tsukamoto, and trumpeter and bandmate from middle school, Reina Kousaka.

However, in the band itself, chaos reigns supreme. Despite their intention to qualify for the national band competition, as they currently are, just competing in the local festival will be a challenge—unless the new band advisor Noboru Taki does something about it.

From the studio that animated Suzumiya Haruhi no Yuuutsu, Kyoto Animation's Hibike! Euphonium is a fresh and musical take on the slice-of-life staple that is the high school student's struggle to deal with their past, find romance, and realize their dreams and aspirations.

"
"Ie Naki Ko Remy","8.02","Ranked #555","Remy, a cheerful and tender-hearted girl, lives with her mother in a French country town. One day her father returns to the town after a long period working away from home in a city. Her father tells Remy that she isn't their real daughter, and Remy is almost sold to an evil slave trader. It is Vitalis, a strolling entertainer, who helps Remy. Vitalis discovers her talent for singing and decides to take her in with his troupe.

(Source: ANN)"
"Kaleido Star","8.02","Ranked #556","As a talented young acrobat, Sora has dreamed of sharing a stage with the performers of Kaleido Stage, a world renowned circus that combines graceful acrobatics, dazzling costumes, and stunts that keep audiences on the edge of their seats. She makes the move from Japan to California to audition for the show, in hopes of one day basking in the glitz and glamour.

However, finding her place in such a competitive world will not be easy. Sora will shed blood, sweat, and tears on her path to becoming a performer, buoyed by the friends she makes along the way. Of course, there will also be rivals and other individuals who do not believe Sora has what it takes to shine as brightly as Kaleido Stage needs her to.

Sora will need to endure these trials and tribulations in her quest to become a star, earning the respect of both those who doubt her abilities and by those who are threatened by her. Watch as Sora flies through the bright lights in Kaleido Star!"
"Kekkai Sensen & Beyond","8.02","Ranked #557","Three years ago, a gateway between Earth and the Beyond opened in New York City, trapping extradimensional creatures and humans alike in an impermeable bubble. After the city's restoration, monsters, magic, and madness are common findings in the area now known as Hellsalem's Lot. Leonardo Watch, a young photographer who unwillingly obtained the ""All-seeing Eyes of the Gods"" in exchange for his sister's eyesight, came to this paranormal city to find answers to the mysterious power that he possesses. He later finds his life drastically changed when he joins Libra, a secret organization of people with supernatural abilities dedicated to maintaining order in the everyday chaos of Hellsalem's Lot. 

However, this is only the beginning of Leonardo's unexpected journey ahead. Regardless of the constant threat of otherworldly enemies, he is determined to uncover the secrets of his power and find a way to restore his sister's eyesight. Kekkai Sensen & Beyond follows Leonardo as he sets off on more crazy adventures with his comrades, fighting to ensure peace and order.

"
"One Piece 3D2Y: Ace no shi wo Koete! Luffy Nakama Tono Chikai","8.02","Ranked #558","The special takes place during the two year before the Straw Hats reunite on Sabaody. Luffy is currently in Rusukaina training to get stronger to take on the New World. However the training is interrupted when Hancock's sisters, Marigold and Sandersonia, are kidnapped by the Byrnndi World, a pirate who was locked away on Level 6 of Impel Down but escaped during Luffy's invasion to save Ace, in order to lure Hancock to him and use her as a hostage against the World Government due to her Shichibukai status. Thus Luffy and Hancock head off to confront him and save Hancock's sisters.

(Source: One Piece Wiki)"
"Saiunkoku Monogatari","8.02","Ranked #559","Most people think being born into a noble family means a life of comfort and wealth. That couldn't be further from the truth for Shuurei Kou. Despite the Kou family being an old and important bloodline, they've fallen on hard times. Shuurei's father works as an archivist in the Imperial library, which is a prestigious position, but unfortunately not one that pays much. To put food on the table, Shuurei works odd jobs such as teaching young children or playing live music in a restaurant―and even then, it's barely enough.

Then, one day, a court advisor makes Shuurei an offer. If she becomes the concubine of the new, but lazy, emperor and teaches him how to become a good ruler, then she will receive 500 pieces of gold. Never one to turn down good money, Shuurei accepts the proposition. After all, the new emperor only prefers men so her virtue is safe… or so she thinks. 

The more time she spends in the palace, the more her old dream of becoming a court official is reignited. There's only one problem: she's a woman and women do not become government officials. Shuurei may be able to turn the emperor into a good ruler, but will it be at the expense of her own aspirations?"
"Tiger & Bunny","8.02","Ranked #560","In Stern Bild City, those with special abilities are called ""NEXT,"" and can use their powers for good or bad. A unique organized group of NEXT appear regularly on Hero TV, where they chase down evildoers to bring limelight to their sponsors and earn Hero Points in the hopes of becoming the next ""King of Heroes.""

Kotetsu T. Kaburagi, known as ""Wild Tiger,"" is a veteran hero whose performance has been dwindling as of late, partially due to his inability to cooperate with other heroes. After a disappointing season in which most of the other heroes far outperformed Tiger, he is paired up with a brand new hero who identifies himself by his real name—Barnaby Brooks Jr.

Barnaby, nicknamed ""Bunny"" by his frivolous new partner, quickly makes it clear that the two could not be more different. Though they mix as well as oil and water, Tiger and Bunny must learn to work together, both for the sake of their careers and to face the looming threats within Stern Bild.

"
"Beelzebub","8.01","Ranked #562","Ishiyama High is a school populated entirely by delinquents, where nonstop violence and lawlessness are the norm. However, there is one universally acknowledged rule—don't cross first year student Tatsumi Oga, Ishiyama's most vicious fighter.

One day, Oga is by a riverbed when he encounters a man floating down the river. After being retrieved by Oga, the man splits down the middle to reveal a baby, which crawls onto Oga's back and immediately forms an attachment to him. Though he doesn't know it yet, this baby is named Kaiser de Emperana Beelzebub IV, or ""Baby Beel"" for short—the son of the Demon Lord!

As if finding the future Lord of the Underworld isn't enough, Oga is also confronted by Hildegard, Beel's demon maid. Together they attempt to raise Baby Beel—although surrounded by juvenile delinquents and demonic powers, the two of them may be in for more of a challenge than they can imagine.

"
"Date A Live II: Kurumi Star Festival","8.01","Ranked #563","On the day of the Tanabata festival, Shidou Itsuka happens to meet the eerie Kurumi Tokisaki, who proceeds to ask him out on a date. Although nervous, Shidou accepts the offer. The two spend their time visiting to a planetarium, buying food at the festival, and trying out a mock wedding ceremony. Meanwhile, Shirou's friends—Tooka Yatogami, Yoshino, and Kotori Itsuka—are looking for him, while also enjoying the festival themselves.
 
As Shidou spends the day with Kurumi, he begins to notice an unexpected softer side of her. He knows that Kurumi is infamously called the ""Worst Spirit,"" but the girl standing before him is a gentle soul. However, as the day draws to a close, Shirou finally begins to understand the truth behind it all.
 
"
"Full Metal Panic! The Second Raid","8.01","Ranked #564","After overcoming various tumultuous events, mercenary sergeant Sousuke Sagara of Mithril and ""Whispered"" school girl Kaname Chidori return to their normal high school lives. Sousuke continues his efforts to assimilate with the civilian population and manage his mission at the same time, while Kaname attempts to support his endeavors (even though his antics often drive her up a wall). 

However, as their lives calm, new problems begin to appear. The appearance of an independent terrorist organization  known as Amalgam and internal conflicts within Mithril threaten to wreak unity into a series of failures and betrayals. And new, powerful Arm Slave models only worsen the situation when the world's peace is at stake. 

As Kaname and Sousuke face their own inner battles amidst life-threatening fights, will they be able to make the right choices and change their future?

"
"Grisaia no Rakuen","8.01","Ranked #565","Grisaia no Rakuen begins right at the end of the previous installment, Grisaia no Meikyuu. Kazami Yuuji is arrested under suspicion for terrorism. A video showing apparently concrete proof that Yuuji committed these acts, and he is held in custody by Ichigaya.

Ichigaya knows full well that Yuuji didn't commit the crimes he has been accused of. But he did fail to assassinate Heath Oslo, who is the leader of the terrorist organization with an extremely devastating weapon in their possession. In fact, Ichigaya have their own plans for Yuuji... 

But all may not be lost for Yuuji. The girls of the Mihama Academy are not about to let Yuuji be used for political gain, and neither may the mysterious new figure which appears before them."
"Jigoku Shoujo Futakomori","8.01","Ranked #566","Ai Enma and her companions continue to offer their service of revenge against those who have wronged others, and the price is as steep as ever—for damning the offender to hell, the person exacting vengeance is sent to the abyss as well. As they cast soul after soul into the darkness, a new sinister force is watching them: a little girl named Kikuri.

While Ai continues her duties, she meets a boy named Takuma Kurebayashi, known as the ""Devil's Child"" because of the horrific events that occur around him. Unfortunately, Takuma's reputation leads the townspeople to use him as a scapegoat for those who have been ferried off to hell. When things quickly spiral out of control, Ai must find a way to bring an end to this senseless violence, as it poses a threat to her very existence.

"
"Kuuchuu Buranko","8.01","Ranked #567","Many patients with different problems visit the psychiatric ward of Irabu General Hospital; a trapeze artist suffering from insomnia after suddenly failing his jumps, a gangster afraid of knives and sharp objects and a business man who has an erection 24 hours a day. They undergo counseling by Dr. Ichiro Irabu, who is the child-like son of the hospital director. His assistant is the sullen faced sexy nurse Mayumi. With his mysterious injections, and advice that does not make sense, Dr. Irabu confuses his patients. But at the end of his unique treatments, the patients are led to digging further into their souls to find peace of mind.

(Source: fujicreative.co.jp)"
"Lupin III vs. Detective Conan: The Movie","8.01","Ranked #568","It is a cross over between the series Lupin III and Detective Conan and takes place after the television special Lupin the 3rd vs Detective Conan. The plot follows Conan Edogawa who sets out to apprehend Arsène Lupin III, the suspect of stealing a jewel called Cherry Sapphire.

(Souce: Wikipedia)"
"Macross","8.01","Ranked #569","After a mysterious spaceship crashes into Earth, humanity realizes that they are not alone. Fearing a potential threat from space, the world pushes aside their nationalism, conflicting interests, and cultural differences, unifying under the banner of the United Nations. The newly formed UN forces decide to repurpose the alien spacecraft, naming it SDF-1 Macross. Unfortunately, on the day of its maiden voyage, a fleet of spaceships belonging to a race of aliens known as Zentradi descend upon Earth, and the SDF-1 Macross, acting of its own accord, shoots down the incoming squadron, sparking an intergalactic war.

In an attempt to escape, the Macross tries to launch itself into the Moon's orbit, but the ship—as well as the city was in—is teleported to the far reaches of space. Caught up in this mess are Hikaru Ichijou, a free-spirited acrobatic pilot, and Minmay Lynn, an aspiring idol. These two, alongside Macross' crew, experience an epic journey rife with grief and drama, coming face-to-face with the cruelties of war along the way.

"
"Mawaru Penguindrum","8.01","Ranked #570","For the Takakura family, destiny is an ever-spinning wheel, pointing passionately in their direction with equal tides of joy and sorrow before ticking on to the next wishmaker. With their parents gone, twin brothers Kanba and Shouma live alone with their beloved little sister Himari, whose poor health cannot decline any further.

On the day Himari is given permission to temporarily leave the hospital, her brothers take her out to the aquarium to celebrate, where the family's supposed fate is brought forth with her sudden collapse. However, when Himari is inexplicably revived by a penguin hat from the aquarium's souvenir shop, the hand of fate continues to tick faithfully forward.

With her miraculous recovery, though, comes a cost: there is a new entity within her body, whose condition for keeping her fate at bay sends the boys on a wild goose chase for the mysterious ""Penguin Drum."" In their search, the boys will have to follow the threads of fate leading from their own shocking past and into the lives of other wishmakers vying for the Penguin Drum, all hoping to land upon their chosen destiny.

"
"Plastic Memories","8.01","Ranked #571","Eighteen-year-old Tsukasa Mizugaki has failed his college entrance exams, but after pulling some strings, he manages to land a job at the Sion Artificial Intelligence Corporation. SAI Corp is responsible for the creation of ""Giftias""—highly advanced androids which are almost indiscernible from normal humans. However, unlike humans, Giftias have a maximum lifespan of 81,920 hours, or around nine years and four months. Terminal Service One, the station Tsukasa was assigned to, is responsible for collecting Giftias that have met their expiration date, before they lose their memories and become hostile.

Promptly after joining Terminal Service One, Tsukasa is partnered with a beautiful Giftia named Isla. She is a Terminal Service veteran and considered the best in Giftia retrievals, contrary to her petite figure and placid nature. Time is fleeting though, and Tsukasa must come to terms with his feelings for Isla before her time is up. No matter how much someone desires it, nothing lasts forever.

"
"Sekaiichi Hatsukoi","8.01","Ranked #572","After having to deal with jealousy from his co-workers for working under his father's name, prideful literary editor Ritsu Onodera is determined to establish himself in the industry. To accomplish this, he quits his job at his father's publishing company and transfers to Marukawa Publishing. But instead of being placed in their literary division, Ritsu finds himself working as the rookie manga editor for the Emerald editing department, a team that operates under extremely tight schedules in order to meet deadlines. There, Ritsu is introduced to the infamous editor-in-chief Masamune Takano, a persistent man who strives for results.

As it turns out, Takano is actually Ritsu's high school love, and it is the aftermath of that heartbreak has caused Ritsu's reluctance to fall in love again. Now with the two reunited after several years of separation, the reestablishment of their relationship is marked by Takano's vow to make Ritsu say that he loves him again.

Sekaiichi Hatsukoi follows three couples that are interconnected within the manga industry, with each being subject to the budding of first love. 

"
"Serial Experiments Lain","8.01","Ranked #573","Lain Iwakura, an awkward and introverted fourteen-year-old, is one of the many girls from her school to receive a disturbing email from her classmate Chisa Yomoda—the very same Chisa who recently committed suicide. Lain has neither the desire nor the experience to handle even basic technology; yet, when the technophobe opens the email, it leads her straight into the Wired, a virtual world of communication networks similar to what we know as the internet. Lain's life is turned upside down as she begins to encounter cryptic mysteries one after another. Strange men called the Men in Black begin to appear wherever she goes, asking her questions and somehow knowing more about her than even she herself knows. With the boundaries between reality and cyberspace rapidly blurring, Lain is plunged into more surreal and bizarre events where identity, consciousness, and perception are concepts that take on new meanings.

Written by Chiaki J. Konaka, whose other works include Texhnolyze, Serial Experiments Lain is a psychological avant-garde mystery series that follows Lain as she makes crucial choices that will affect both the real world and the Wired. In closing one world and opening another, only Lain will realize the significance of their presence.

"
"Shijou Saikyou no Deshi Kenichi OVA","8.01","Ranked #574","OVAs of History's Strongest Disciple Kenichi bundled with volumes 46, 47, 49, 53, 54, 55, & 56 of the manga."
"Takarajima","8.01","Ranked #575","Jim Hawkins is a young boy lead by progressive events to embark on a search journey for the legendary treasure of the once dreaded pirate, Captain Flint. On their way to Treasure Island, John Silver, Jim's best friend, take over command of the ship revealing his true self as the ruthless pirate who once was the right hand of Flint himself. Feeling betrayed, Jim now has to deal with his mixed feelings and face Silver who still consider himself and Jim as friends. 

(Source: ANN)"
"xxxHOLiC Movie: Manatsu no Yoru no Yume","8.01","Ranked #576","Summer break has arrived, but while his other classmates are out having fun, Kimihiro Watanuki continues to work as compensation for the eccentric Yuuko in her shop. With the spirits and supernatural phenomena that bother him lessening, he pays his dues by cleaning, cooking, and doing whatever else the apparently lazy Yuuko needs.

Watanuki, however, gets involved in a new predicament when Yuuko receives a mysterious invitation to a mansion whose owner seeks Yuuko's wish-granting ability. When he, Yuuko, and his classmate Shizuka Doumeki make their way to the peculiar residence, they meet others who were summoned by the same strange invitation. All of them are collectors of various unique items, drawn there by the chance to expand their collections. But as the collectors begin to disappear one by one, Watanuki and his companions must solve the mystery and put the case to rest, or find themselves in risk of danger.

"
