"nome","nota","ranked","synopsis"
"Detective Conan Movie 21: The Crimson Love Letter","7.81","Ranked #893","A bombing case at Nichiuri TV in autumn. The Satsuki Cup, which crowns the winner of Japan's Hyakunin Isshu, is currently being filmed inside the facility. The incident results in a big commotion and, while the building is burning to ashes, the only people left inside are Heiji and Kazuha. They get rescued just in time by Conan, who rushes to the scene. Both the identity and purposes of the bomber are unknown.

While confusion takes over due to the explosion, Conan meets a mysterious beautiful girl who claims she is ""Heiji's fiancée"". Her name is Momiji Ooka and she is the Kyoto High School champion of the Karuta game. As fate would have it, Kazuha is going to face Momiji in the Hyakunin Isshu, so she begins to train with the help of Heiji's mother, Shizuka, who is a skilled Karuta player.

At the same time, in a Japanese house in Arashiyama, Kyoto's outskirts, the reigning Satsuki Cup champion is murdered. Pictures of the crime scene reveal Momji's presence. Additionally, several Karuta cards were spread around the victim.

Conan and Heiji, along with the Osaka and Kyoto police departments, begin their investigation on the Satsuki Cup and the related murder case. As the inquiry goes on, they come across a secret connected with the Hyakunin Isshu. 

(Source: Detective Conan Wiki)"
"Dragon Ball Z Special 2: Zetsubou e no Hankou!! Nokosareta Chousenshi - Gohan to Trunks","7.81","Ranked #894","It has been thirteen years since the Androids began their killing rampage and Son Gohan is the only person fighting back. He takes Bulma's son Trunks as a student and even gives his own life to save Trunks's. Now Trunks must figure out a way to change this apocalyptic future. 

(Source: ANN) "
"Dungeon ni Deai wo Motomeru no wa Machigatteiru Darou ka","7.81","Ranked #895","Life in the bustling city of Orario is never dull, especially for Bell Cranel, a naïve young man who hopes to become the greatest adventurer in the land. After a chance encounter with the lonely goddess, Hestia, his dreams become a little closer to reality. With her support, Bell embarks on a fantastic quest as he ventures deep within the city's monster-filled catacombs, known only as the ""Dungeon."" Death lurks around every corner in the cavernous depths of this terrifying labyrinth, and a mysterious power moves amidst the shadows.

Even on the surface, survival is a hard-earned privilege. Indeed, nothing is ever certain in a world where gods and humans live and work together, especially when they often struggle to get along. One thing is for sure, though: a myriad of blunders, triumphs and friendships awaits the dauntlessly optimistic protagonist of this herculean tale.

"
"Genshiken 2","7.81","Ranked #896","The Society for the Study of Modern Visual Culture, otherwise known as Genshiken, is now under the charge of a more confident Sasahara. Things have changed in between semesters, and the otaku club now has a new otaku-hating member named Ogiue. Sasahara's initial goal of starting a doujin circle and selling those fan-made magazines at the next Comic Festival becomes a reality, but reality is a cruel master... who apparently crossplays. Afterward, the club is abuzz with talk about Tanaka and Ohno's relationship, which takes a hesitant step forward.

(Source: Media Blasters)"
"Hakuouki Movie 1: Kyoto Ranbu","7.81","Ranked #897","Chizuru Yukimura has come to Kyoto looking for her father, a doctor who has gone missing. While there, she witnesses a fight between an Oni and the Shinsengumi. Taking her into custody, the Shinsengumi debates on what to do with Chizuru, when they discover that she is the daughter of the doctor for whom they are also looking. The Shinsengumi then take Chizuru along on their search after the missing doctor, from adventure to adventure.

(Source: ANN)"
"Hataraku Saibou","7.81","Ranked #898","Inside the human body, roughly 37.2 trillion cells work energetically 24 hours a day and 365 days a year. Fresh out of training, the cheerful and somewhat airheaded Red Blood Cell AE3803 is ready to take on the ever-so-important task of transporting oxygen. As usual, White Blood Cell U-1146 is hard at work patrolling and eliminating foreign bacteria seeking to make the body their new lair. Elsewhere, little platelets are lining up for a new construction project. 

Dealing with wounds and allergies, getting lost on the way to the lungs, and bickering with similar cell types, the daily lives of cells are always hectic as they work together to keep the body healthy!

"
"Inuyashiki","7.81","Ranked #899","Ichirou Inuyashiki is a 58-year-old family man who is going through a difficult time in his life. Though his frequent back problems are painful, nothing hurts quite as much as the indifference and distaste that his wife and children have for him. Despite this, Ichirou still manages to find solace in Hanako, an abandoned Shiba Inu that he adopts into his home. However, his life takes a turn for the worse when a follow-up physical examination reveals that Ichirou has stomach cancer and only three months to live; though he tries to be strong, his family's disinterest causes an emotional breakdown. Running off into a nearby field, Ichirou embraces his dog and weeps—until he notices a strange figure standing before him.

Suddenly, a bright light appears and Ichirou is enveloped by smoke and dust. When he comes to, he discovers something is amiss—he has been reborn as a mechanized weapon wearing the skin of his former self. Though initially shocked, the compassionate Ichirou immediately uses his newfound powers to save a life, an act of kindness that fills him with happiness and newfound hope.

However, the origins of these strange powers remain unclear. Who was the mysterious figure at the site of the explosion, and are they as kind as Ichirou when it comes to using this dangerous gift?

"
"Kyou kara Maou!","7.81","Ranked #900","Kyou kara Maou! revolves around Yuri Shibuya, your average Japanese teenager. One day, Yuri sees a classmate being harassed by bullies. Thanks to this intervention, his friend is able to escape, but unfortunately Yuri becomes the new target of the bullies in the process and gets his head shoved into a toilet. But instead of water, the toilet contains a swirling portal that sucks him into another world, largely resembling medieval Europe. There, he is told that he will become the next Demon King due to his black hair and black eyes, traits only possessed by the demon's royal lineage.

Yuri's arrival is met with some skepticism by some of the demons, who view him as unworthy to be their king. However, after Yuri wins a duel by utilizing his magical powers, the demons slowly begin to acknowledge him as their monarch. Yuri must now learn what it takes be a true Demon King, as he tries to keep the peace between demons and humans in this strange new realm."
"Lupin the Third: Mine Fujiko to Iu Onna","7.81","Ranked #901","Many people are falling prey to a suspicious new religion. Lupin III infiltrates this group, hoping to steal the treasure their leader keeps hidden. There he lays eyes on the beautiful, bewitching woman who has the leader enthralled. This is the story of how fashionable female thief Fujiko Mine first met Lupin III, the greatest thief of his generation.

(Source: ANN)"
"Pandora Hearts","7.81","Ranked #903","To young Oz Vessalius, heir to the Vessalius Duke House, the perilous world called the Abyss is nothing more than a folktale used to scare misbehaving children. However, when Oz's coming-of-age ceremony is interrupted by the malicious Baskerville Clan intent on banishing him into the depths of the Abyss, the Vessalius heir realizes that his peaceful life of luxury is at its end. Now, he must confront the world of the Abyss and its dwellers, the monstrous ""Chains,"" which are both not quite as fake as he once believed.

Based on the supernatural fantasy manga of the same name, Pandora Hearts tells the story of fifteen-year-old Oz's journey to discover the meaning behind the strange events that have overtaken his life. Assisted by a mysterious Chain named Alice, whose nickname is ""Bloodstained Black Rabbit,"" and members of a clandestine organization known as ""Pandora,"" Oz begins to realize his existence may have more meaning than he could have ever imagined.

"
"Penguin Highway","7.81","Ranked #904","Schoolboy Aoyama is bright, inquisitive and a bit headstrong. He has a lot of brainwork to get busy with – after all, he'll be an adult in just a few thousand days. For the moment, though, he'll have to live life as a fourth-grader. Not that it's a bad life.

Summer has arrived and school's nearly out. He has a crush on an intriguing older woman he's met at his dentist's office, who's coaching him in his chess game. And a colony of penguins has materialized in the middle of Aoyama's sleepy little town. Where on Earth – or elsewhere – did these waddling interlopers come from? Aoyama and his friends embark on a research mission, applying rigorous scientific methods and principles. Their discoveries, however, only lead to ever more puzzling wonders...

(Source: Fantasia)"
"Shingeki no Kyojin: Lost Girls","7.81","Ranked #905","Bundled with the 24th, 25th, and 26th volumes of the Shingeki no Kyojin manga. "
"Soukou Kihei Votoms","7.81","Ranked #906","A century of bloodshed between warring star systems has plunged nearly 200 worlds into the flames of war. Now, an uneasy truce has settled across the Astragius Galaxy...

Chirico Cuvie, a special forces powered-armor pilot is suddenly transferred into a unit engaged in a secret and highly illegal mission to steal military secrets—from their own military! Now he's on the run...from his own army!

Unsure of his loyalties and to cover their own tracks, Chirico is left behind to die in space. Surviving by luck, the renegade is now hunted by both the conspirators and military intelligence.

He is driven by the haunting image of a mysterious and beautiful woman—the objective of their mission, and his sole clue to unraveling their treacherous scheme. But the conspirators will do anything to preserve their mysterious agenda...

(Source: AnimeNfo)"
"Udon no Kuni no Kiniro Kemari","7.81","Ranked #907","Taking a break from the hustle and bustle of Tokyo, Souta Tawara returns to his hometown in Kagawa. Though his parents are no longer around, his former home and family-owned udon restaurant reminds him of the times his family was still together. Reminiscing about his childhood, Souta enters the udon restaurant and discovers a grimy young boy sleeping.

At first, Souta thinks nothing of the chance encounter and provides the boy with food and clothing. However, to his surprise, the boy suddenly sprouts a furry pair of ears and a tail! Souta soon learns that the nameless boy is actually the rumored shapeshifting tanuki that has been inhabiting Kagawa for many years. Thinking that the boy has been living a lonely life, he decides to take him in and name him Poko.

Udon no Kuni no Kiniro Kemari follows the heartwarming relationship between Souta and Poko, and through the time they spend together, Souta recalls his own past, the place he left behind for the city, and the relationship he had with his father.

"
"Arakawa Under the Bridge x Bridge","7.80","Ranked #908","In the dry riverbed of Arakawa River, undefeated elite Ichinomiya Kou (aka Ric) met the lovely homeless girl Nino, a self-declared Venusian. Their awkward love stirs up trouble among the other strange inhabitants of the riverbed.

(Source: ANN)"
"Arashi no Yoru ni","7.80","Ranked #909","A story about a goat and a wolf who become friends on a stormy night, and how they overcome differences and hardships.

(Source: ANN)
"
"Binbougami ga!","7.80","Ranked #910","Ichiko Sakura lives life on easy mode. Blessed with good fortune, she has everything she has ever wanted, including beauty, intelligence, and wealth. Momiji Binboda is a goddess of poverty. In stark contrast to Ichiko, she is cursed with misfortune, such as a perpetual cast on her arm, a flat chest, and a box under a bridge for a home.

Their lives collide when Momiji lives up to her title and delivers some unfortunate news to Ichiko: her large amount of luck is due to her subconsciously draining the luck from those around her! Momiji has been tasked with stealing back Ichiko's fortune before she leaves everyone without enough luck to even survive. But Ichiko, with the help of the wandering monk Bobby Statice, manages to fight off the poverty goddess. This defeat forces the goddess to enlist reinforcements in the form of Kumagai, her teddy bear familiar, and the masochistic dog god, Momoo Inugami.

Insanity ensues as Ichiko's quiet life is replaced with daily battles for her fortune. To survive the chaos, Ichiko will need all the luck she can get in Binbougami ga!!

"
"Bokura wa Minna Kawai-sou","7.80","Ranked #911","Kazunari Usa is a high school freshman who will start living alone due to his parents now working in a different area. Excited for his new independent life, he hopes to go about his teenage days without the worry of dealing with any strange people, but as he soon discovers, his new boarding house Kawai Complex is far from ordinary.

The various tenants at Kawai Complex are all quite eccentric characters. Shirosaki, Kazunari's roommate, is a pervert and masochist; Mayumi Nishikino, a borderline alcoholic office lady, hates couples because of her unfortunate luck with men; and Sayaka Watanabe, a seemingly innocent college student, enjoys leading men on. Shocked with the lack of decent individuals at his new residence, Kazunari is about to leave when he runs into shy senior student Ritsu Kawai and finds himself slowly falling in love with her.

"
"Code Geass: Hangyaku no Lelouch II - Handou","7.80","Ranked #912","Having achieved miraculous victories in a series of battles against the Britannian Army, Lelouch Lamperouge has brought the Black Knights, his paramilitary organization, to a more powerful state than ever before. Nothing seems impossible for him when he utilizes his military strength, intellect, and Geass power of absolute obedience. 

However, obstacles in the face of the uprising never cease, putting Lelouch in a difficult predicament. Most worryingly, Suzaku Kururugi's combat prowess and the appearance of a mysterious child named V.V. threaten to put an end Lelouch's great rebellion. 

"
"Digimon Adventure: Bokura no War Game!","7.80","Ranked #913","This movie takes place after the Adventure series ends. It begins when a new Digimon Egg is found on the internet, and manages to penetrate into almost every computer system in Japan. When the egg hatches, it's identified as a new kind of Digimon, a Virus-type. It sustains itself by eating data from various system, and starts wreaking havok in Japan. As it consumes more and more data, it continues to evolve. And Taichi and Koushiro decide it's time to stop it.

They're off, sending Agumon and Tentomon through the internet to fight off this new enemy. But, with the Virus controlling systems like the American military, all too soon, this digital menace may become all too real. Calling in the help of Yamato and Takeru, they hope that they can stop what's already begun, and maybe save this world a second time.

(Source: AniDB)"
"Go! Princess Precure","7.80","Ranked #914","Once upon a time, there was a little girl who desperately wanted to become a princess just like the ones in her picture book. Other children made fun of her childish wishes, but she never stopped believing. One day, a boy who looked like a prince appeared, asking her if she would like to be a princess. He gave the girl magical charm to make her wish come true.

That little girl, Haruka Haruno, is now a thirteen-year-old attending Noble Academy, a junior high boarding school. Her school life is interrupted by two fairies, Pafu and Aroma, who give her a Princess Perfume, which mysteriously matches the charm she was given eight years ago! Turns out, Haruka is one of the Princess Precures, and must team up with Cure Mermaid and Cure Twinkle in Go! Princess Precure in order to defeat the dark witch Dyspear before she brings the the Hope Kingdom and Haruka's world to a nightmareish end!"
"Golden Kamuy","7.80","Ranked #915","In Hokkaido, the far northern lands of Japan, Sugimoto survived the Russo-Japanese war of the Meiji era. Nicknamed ""Sugimoto the Immortal"" during the war, he now seeks the riches promised by the gold rush in hopes of saving the widowed wife of his now deceased comrade from the war. During his hunt of gold, he finds hints of a hidden stash of gold by corrupt criminals. Partnering with an Ainu girl that saves his life from the harsh climates of the north, they venture into a survival adventure to race against the criminals that seek the hidden stash.

(Source: MangaUpdates)"
"Hai to Gensou no Grimgar","7.80","Ranked #916","Fear, survival, instinct. Thrown into a foreign land with nothing but hazy memories and the knowledge of their name, they can feel only these three emotions resonating deep within their souls. A group of strangers is given no other choice than to accept the only paying job in this game-like world—the role of a soldier in the Reserve Army—and eliminate anything that threatens the peace in their new world, Grimgar.

When all of the stronger candidates join together, those left behind must create a party together to survive: Manato, a charismatic leader and priest; Haruhiro, a nervous thief; Yume, a cheerful hunter; Shihoru, a shy mage; Mogzo, a kind warrior; and Ranta, a rowdy dark knight. Despite its resemblance to one, this is no game—there are no redos or respawns; it is kill or be killed. 

It is now up to this ragtag group of unlikely fighters to survive together in a world where life and death are separated only by a fine line. 

"
"Hetalia World Series","7.80","Ranked #917","The third and fourth seasons of the Hetalia Axis Powers anime. A continuation of the first 2 seasons under a new name, still adapting the online webcomics drawn by Himaruya Hidekaz.

Based on a popular web-released manga series by Hidekazu Himaruya, this has been described as a ""cynical gag"" story set in Europe in the years between WW1 and WW2 (1915-1939), using exaggerated caricatures of the different nationalities as portrayed by a gaggle of bishōnen. For example, the Italia Veneziano character is into pasta and women. The Deutsche (German) bishi loves potatoes and sausages, and Nippon is an otaku boy. Installments of the manga have jumped back and forth in setting from the ancient times to modern-day geopolitics. The manga's title comes the Japanese words for ""useless"" (hetare) and Italy (Italia).

(Source: ANI)"
"Kochira Katsushikaku Kameari Kouenmae Hashutsujo","7.80","Ranked #918","Ryoutsu, being an underpaid policeman, is always coming up with underhanded schemes in order to make a quick buck. But in the end, his plans (which are ridiculous to begin with) always go wrong and land him in big trouble with the chief."
"Kono Oto Tomare!","7.80","Ranked #919","Since the graduation of the senior members of the club, Takezou ends up being the sole member of the ""Koto"" (traditional Japanese string instrument) club. Now that the new school year has begun, Takezou will have to seek out new members into the club, or the club will become terminated. Out of nowhere, a new member barges into the near-abandoned club room, demanding to join the club. How will Takezou be able to keep his club alive and deal with this rascal of a new member?

(Source: MangaHelpers)"
"Kyoukai no Kanata Movie 1: I'll Be Here - Kako-hen","7.80","Ranked #920","The first part of a two-part movie. The story is a recap of the TV series."
"Nurarihyon no Mago OVA","7.80","Ranked #921","The story begins at about 100 years after the disappearance of Otome Yamabuki, Rihan Nura's first wife. Rihan has finally pulled himself together and his life returns to normal. As the head of the Nura Clan, he's busy working on building a harmonious world for humans and youkais. One day, he sees Setsura being upset so he decides to cheer her up by taking the clan to go enjoy the hot spring where Setsura makes up her mind to tell Rihan that she met Otome once after she left him about 100 years ago. She tells him the message that Otome left for him and the truth is...? 

(Source: Mangahere.com) "
"School Rumble: Ichi Gakki Hoshuu","7.80","Ranked #922","This two-part OVA is a series of shorts in relation to the School Rumble series. This OVA fills in gaps with new content between episodes from beginning to nearly the end.

(Source: ANN)"
"Seitokai Yakuindomo*","7.80","Ranked #923","They say that the more things change, the more they stay the same, and those words could not be more true for the student council of Ousai Private Academy. Though an entire year has passed—bringing the senior members to their final year of high school—not much has changed. President Shino Amakusa is just as perverted as ever, Secretary Aria Shichijou still refuses to put on a pair of panties, Treasurer Suzu Hagimura has yet to grow an inch, and Vice President Takatoshi Tsuda is still stuck as the straight man to their crazy antics.
 
Of course, limiting the fun to a four-way might get a little stale; although the group still messes around with the Judo Club and the Newspaper Club, more girls have come to get in on the excitement. Takatoshi's sister Kotomi, a new student at Ousai, is as perverse as the president, while Uomi, the aloof student council president of the nearby Eiryou High School, fits right in with the insanity at Ousai. With loads of absurdity and sexual humor that keeps on coming, Takatoshi needs to harden up if he is going to keep up with all the madness around him.

"
"Sexy Commando Gaiden: Sugoiyo!! Masaru-san","7.80","Ranked #924","Okometsubu Fujiyama has recently transferred over to a new school, Wakame High School. His goal is to make 100 friends--until he meets the extremely weird Masaru Hananakajima. Masaru is a martial artist whose specialty is the ""Sexy Commando"" form of martial art. Masaru forms a club based on this art, including Fujiyama, who he nicknames Fuumin, in the club. The club becomes full of strange, yet wacky people. Aliens, mustaches, and cute fuzzy animals are encountered as the club moves along and gets steadily more popular.

(Source: ANN) "
"Toaru Kagaku no Railgun","7.80","Ranked #925","The student-filled Academy City is at the forefront of scientific advancement and home to the esper development program. The seven ""Level 5"" espers are the most powerful in Academy City, and ranked third among them is middle schooler Mikoto Misaka, an electricity manipulator known as ""The Railgun.""
 
When strange incidents begin occurring throughout the city, she finds each crime to be connected to the elusive ""Level Upper,"" a legendary device that allegedly increases the esper level of its user. As the situation escalates, it becomes apparent that there is more to the Level Upper than meets the eye, and that Academy City may be a far more twisted place than the glamorous utopia it appears to be.

Toaru Kagaku no Railgun focuses on Mikoto and her friends—and the dangerous situations they find themselves in—as they get caught up in the matter of the Level Upper. As Mikoto says, ""There's never a dull moment in this city.""

"
"Uchuu Kaizoku Captain Herlock","7.80","Ranked #926","It is 2977 AD and mankind has become stagnant. Robots do all the work, the masses are kept tranquil by subliminal messages, and government officials are lazy, caring only about recreational activities like golf and horse racing. Captain Herlock has defied this insipid mentality, leading a group of like-minded rebels to a more adventurous life aboard the spaceship Arcadia.
 
A mysterious force known as the Mazone has invaded the Earth, taking the form of mysterious cloaked women that kill anyone who suspect their nefarious doings, such as Tadashi Daiba who is now on their hit-list. After his scientist father is ignored by the government and killed by the Mazone, he joins Captain Herlock and his ragtag group of pirates to assist them as they try to save humanity from the impending alien threat.

"
"Yamada-kun to 7-nin no Majo","7.80","Ranked #927","When Ryuu Yamada entered high school, he wanted to turn over a new leaf and lead a productive school life. That's why he chose to attend Suzaku High, where no one would know of his violent delinquent reputation. However, much to Ryuu's dismay, he is soon bored; now a second year, Ryuu has reverted to his old ways—lazy with abysmal grades and always getting into fights.

One day, back from yet another office visit, Ryuu encounters Urara Shiraishi, a beautiful honors student. A misstep causes them both to tumble down the stairs, ending in an accidental kiss! The pair discover they can switch bodies with a kiss: an ability which will prove to be both convenient and troublesome.
 
Learning of their new power, Toranosuke Miyamura, a student council officer and the single member of the Supernatural Studies Club, recruits them for the club. Soon joined by Miyabi Itou, an eccentric interested in all things supernatural, the group unearths the legend of the Seven Witches of Suzaku High, seven female students who have obtained different powers activated by a kiss. The Supernatural Studies Club embarks on its first quest: to find the identities of all the witches.

"
