"nome","nota","ranked","synopsis"
"Fate/stay night: Unlimited Blade Works","8.30","Ranked #231","The Holy Grail War is a battle royale among seven magi who serve as Masters. Masters, through the use of the command seals they are given when they enter the war, command Heroic Spirits known as Servants to fight for them in battle. In the Fifth Holy Grail War, Rin Toosaka is among the magi entering the competition. With her Servant, Archer, she hopes to obtain the ultimate prize—the Holy Grail, a magical artifact capable of granting its wielder any wish.
 
One of Rin's classmates, Emiya Shirou, accidentally enters the competition and ends up commanding a Servant of his own known as Saber. As they find themselves facing mutual enemies, Rin and Shirou decide to form a temporary alliance as they challenge their opponents in the Holy Grail War. 

"
"Hibike! Euphonium 2","8.30","Ranked #232","Following their success in the qualifying round for the Kansai regional competition, the members of the Kitauji High School concert band set their sights on the next upcoming performance. Utilizing their summer break to the utmost, the band participates in a camp where they are instructed by their band advisor Noboru Taki and his friends who make their living as professional musicians.

Kumiko Oumae and her friends remain determined to attain gold at the Kansai competition, but trouble arises when a student who once quit the band shows interest in rejoining and sparks unpleasant memories for the second-year members. Kumiko also learns about her teacher's surprising past and the motivation behind his desire to lead the band to victory. Reaching nationals will require hard work, and the adamant conviction in each student's commitment to the band will be put to the test.

"
"InuYasha: Kanketsu-hen","8.30","Ranked #233","Thwarted again by Naraku, Inuyasha, Kagome Higurashi, and their friends must continue their hunt for the few remaining Shikon Jewel shards, lest they fully form into a corrupted jewel at the hands of Naraku. But Naraku has plans of his own to acquire them, and will destroy anyone and anything standing in his way—even his own underlings.

The persistent, unyielding danger posed by Naraku forces Sango and Miroku to decide what is most important to them—each other or their duty in battle. Meanwhile, Inuyasha must decide whether his heart lies with Kikyou or Kagome, before fate decides for him. Amid the race to find the shards, Inuyasha and his brother Sesshoumaru must also resolve their feud and cooperate for their final confrontation with Naraku, as it is a battle they must win in order to put a stop to his evil and cruelty once and for all.

"
"Kawaki wo Ameku","8.30","Ranked #234","Music video for the song Kawaki wo Ameku by Minami."
"Little Busters!: Refrain","8.30","Ranked #235","Riki and his friends have been managing to form a complete team for the Little Busters baseball team and after overcoming some of its new members' internal conflicts, Riki and Rin slowly approach the ""secret of this world.""

Will they be ready for the truth? In this world devoid of logic, something has started to move and soon will come the time when the lives of the Little Busters will change forever.

(Source: Koi-nya, edited)"
"Majo no Takkyuubin","8.30","Ranked #236","Kiki, a 13-year-old witch-in-training, must spend a year living on her own in a distant town in order to become a full-fledged witch. Leaving her family and friends, Kiki undertakes this tradition when she flies out into the open world atop her broomstick with her black cat Jiji.

As she settles down in the coastal town of Koriko, Kiki struggles to adapt and ends up wandering the streets with no place to stay—until she encounters Osono, who offers Kiki boarding in exchange for making deliveries for her small bakery. Before long, Kiki decides to open her own courier service by broomstick, beginning her journey to independence. In attempting to find her place among the townsfolk, Kiki brings with her exciting new experiences and comes to understand the true meaning of responsibility.

"
"Major S4","8.30","Ranked #237","Having finished high school, Gorou Honda sets his sights on becoming a professional baseball player. His dreams are much more ambitious than becoming a Japanese Baseball League player, so he instead decides to move to the birthplace of his beloved sport, America, in order to play in the Major League.

However, Gorou finds that the Major League players are much faster, stronger, and more driven than he is. Nonetheless, he is eager to catch up with them. In order to do so, Gorou must first conquer the ranks of the Minor League, where numerous skilled players compete in the grueling rise to the Majors.

Gorou joins the Memphis Bats and learns that he will have to adapt to the stark differences of American culture and push himself to new extremes as his race to join the Major League begins.

"
"Sennen Joyuu","8.30","Ranked #238","At the turn of the millennium, Ginei Studio's dilapidated buildings are set to be demolished. Ex-employee and filmmaker Genya Tachibana decides to honor this occasion with a commemorative documentary about the company's star actress: Chiyoko Fujiwara, the reclusive sweetheart of Shouwa Era cinema. Having finally obtained permission to interview the retired starlet, an enamored Genya drags along cynical cameraman Kyouji Ida to meet her, ready to put his lifelong idol back in the spotlight once more.

Hidden in this secluded mountain retreat is a thousand years of history condensed into one lifetime, waiting to be narrated. Chiyoko's recollections take them on an illusionary journey through Japanese cinematic history that transcends the boundaries of reality; the saga of her acting career intertwines with her filmography, the actors in her life blend seamlessly with the characters on screen, and the present melds with the past. Though the actress may have retired at the height of her career 30 years ago, the curtain on her life's stage has yet to fall.

"
"SKET Dance","8.30","Ranked #239","At Kaimei High School there is a special club dedicated to helping others known as the SKET Brigade. The brains of the group is Kazuyoshi ""Switch"" Usui, a tech-savvy otaku who speaks through speech synthesis software, while the brawn is provided by Hime ""Himeko"" Onizuka, the hockey stick-wielding girl once known as ""Onihime.""  And last but not least, their leader is Yuusuke ""Bossun"" Fujisaki, whose latent ability is evoked by his goggles, allowing him to summon the awesome power of extraordinary concentration.  

However, most of the school only know them as the club that handles odd jobs. Many of their days are spent in the clubroom slacking off, but when there is something to be done, they give their all to help others—usually in sincere, but unintentionally hilarious, ways. The SKET Brigade do all they can to provide support, kindness, encouragement, and troubleshooting to any students crazy enough to ask for their services.  

"
"Steins;Gate: Kyoukaimenjou no Missing Link - Divide By Zero","8.30","Ranked #240","Alternate 23rd episode of Steins;Gate, which leads into the story of Steins;Gate 0. It was included with the Steins;Gate Complete Blu-ray Box. "
"Toki wo Kakeru Shoujo","8.30","Ranked #241","Makoto Konno is in her last year of high school, but is having a hard time deciding what to do with her future. In between enduring the pressure of her teachers and killing time with her best friends, Makoto's life suddenly changes when she accidentally discovers that she is capable of literally leaping through time.

Toki wo Kakeru Shoujo follows Makoto as she plays around with her newfound power. However, she soon learns the hard way that every choice has a consequence, and time is a lot more complicated than it may seem.

"
"Tokyo Godfathers","8.30","Ranked #242","It's Christmas Eve and three homeless friends have experienced their own Christmas miracle: while rummaging in a dump for a Christmas present, they discover a newborn baby. Despite having nothing, the three take the baby in and name her Kiyoko, meaning Pure One.

They embark in search of Kiyoko's mother, based on the little they know about her from her meager belongings. But the night is young, and the city is vast. Before they know it, these three become entangled in a series of events including kidnapping, death, and a mysterious red envelope.

Kind transwoman Hana, runaway teenager Miyuki, and belligerent Gin make an unlikely trio as they care for the baby and try to find where she belongs. By finally looking toward the future, they are also able to confront their pasts, coming just a little bit closer to finding their own place in the world."
"Youjo Senki Movie","8.30","Ranked #243","In 1926, Tanya and her battalion return home from defeating remnants of the Republic's army. However, when they arrive they receive word of a massive mobilization near the border with the Russy Federation, so the Empire's army must prepare. At the same time, a multinational army under the leadership of the Allied Kingdom moves into the Russy Federation. The enemy of an enemy is a friend, but among the Allied Kingdom army is Mary Sioux, a girl who has sworn to exact justice against the Empire for the death of her father.

(Source: ANN)"
"Bakuman.","8.29","Ranked #244","As a child, Moritaka Mashiro dreamt of becoming a mangaka, just like his childhood hero and uncle, Tarou Kawaguchi, creator of a popular gag manga. But when tragedy strikes, he gives up on his dream and spends his middle school days studying, aiming to become a salaryman instead.

One day, his classmate Akito Takagi, the school's top student and aspiring writer, notices the detailed drawings in Moritaka's notebook. Seeing the vast potential of his artistic talent, Akito approaches Moritaka, proposing that they become mangaka together. After much convincing, Moritaka realizes that if he is able to create a popular manga series, he may be able to get the girl he has a crush on, Miho Azuki, to take part in the anime adaptation as a voice actor. Thus the pair begins creating manga under the pen name Muto Ashirogi, hoping to become the greatest mangaka in Japan, the likes of which no one has ever seen.

"
"Ballroom e Youkoso","8.29","Ranked #245","Tatara Fujita is a shy middle schooler who has no particular plan for the future. He has gotten through life by avoiding any kind of confrontation and blending in with the crowd. But blending in isn't enough to get out of trouble, as some bullies harass him for money. Luckily, he is saved by a man named Kaname Sengoku.

Kaname invites Tatara to his dance studio. Although he would normally never set foot in such a place, Tatara is captivated by Sengoku's commanding presence. Granted an opportunity to dance with fellow classmate Shizuku Hanaoka—who often practices at the studio—Tatara realizes there's something about the idea of being put in the limelight and dancing where people will see him that keeps him coming back. With an earnest, passionate drive to improve, Tatara begins his journey into the world of competitive dance.

"
"Detective Conan Movie 13: The Raven Chaser","8.29","Ranked #246","Kudou Shinichi is living his life as Edogawa Conan, but those days seem like they might end pretty soon. The Black Syndicate is coming dangerously close to learning the truth about Shinichi having survived. Conan and everybody around him may end up dead if he doesn't manage to find Irish—a member of the Black Organization who has infiltrated the police forces, currently investigating a big serial murder case."
"Diamond no Ace: Act II","8.29","Ranked #247","Picking up the next year after the end of the fall tournament, Seidou High School baseball team battle it out with new and old faces as they begin their tournament run at Koshien."
"Dragon Ball Super Movie: Broly","8.29","Ranked #248","Forty-one years ago on Planet Vegeta, home of the infamous Saiyan warrior race, King Vegeta noticed a baby named Broly whose latent power exceeded that of his own son. Believing that Broly's power would one day surpass that of his child, Vegeta, the king sends Broly to the desolate planet Vampa. Broly's father Paragus follows after him, intent on rescuing his son. However, his ship gets damaged, causing the two to spend years trapped on the barren world, unaware of the salvation that would one day come from an unlikely ally.

Years later on Earth, Gokuu Son and Prince Vegeta—believed to be the last survivors of the Saiyan race—are busy training on a remote island. But their sparring is interrupted when the appearance of their old enemy Frieza drives them to search for the last of the wish-granting Dragon Balls on a frozen continent. Once there, Frieza shows off his new allies: Paragus and the now extremely powerful Broly. A legendary battle that shakes the foundation of the world ensues as Gokuu and Vegeta face off against Broly, a warrior without equal whose rage is just waiting to be unleashed.

"
"Dragon Ball Z","8.29","Ranked #249","Five years after winning the World Martial Arts tournament, Gokuu is now living a peaceful life with his wife and son. This changes, however, with the arrival of a mysterious enemy named Raditz who presents himself as Gokuu's long-lost brother. He reveals that Gokuu is a warrior from the once powerful but now virtually extinct Saiyan race, whose homeworld was completely annihilated. When he was sent to Earth as a baby, Gokuu's sole purpose was to conquer and destroy the planet; but after suffering amnesia from a head injury, his violent and savage nature changed, and instead was raised as a kind and well-mannered boy, now fighting to protect others.

With his failed attempt at forcibly recruiting Gokuu as an ally, Raditz warns Gokuu's friends of a new threat that's rapidly approaching Earth—one that could plunge Earth into an intergalactic conflict and cause the heavens themselves to shake. A war will be fought over the seven mystical dragon balls, and only the strongest will survive in Dragon Ball Z.

"
"Initial D Final Stage","8.29","Ranked #250","After defeating every racing team in the prefecture, everything comes down to one last race. Takumi Fujiwara has never lost a race, but when his opponent is also using an AE86, it turns into a battle of the AE86. Will Project D succeed in the final and most difficult race of Initial D?"
"Kaguya-hime no Monogatari","8.29","Ranked #251","Deep in the countryside, a man named Okina works as a bamboo cutter in a forest, chopping away at the hollow plants day after day. One day, he discovers a small baby inside a glowing shoot. He immediately takes her home, convinced that she is a princess sent to Earth as a divine blessing from heaven. Okina and his wife Ouna take it upon themselves to raise the infant as their own, watching over her as she quickly grows into an energetic young girl. Given the name Kaguya, she fits right in with the village she has come to call home, going on adventures with the other children and enjoying what youth has to offer.

But when Okina finds a large fortune of gold and treasure in the forest, Kaguya's life is completely changed. Believing this to be yet another gift from heaven, he takes it upon himself to turn his daughter into a real princess using the wealth he has just obtained, relocating the family to a mansion in the capital. As she leaves her friends behind to enter into an unwanted life of royalty, Kaguya's origins and purpose slowly come to light.

"
"Kuroshitsuji: Book of Circus","8.29","Ranked #252","Full of wonder and excitement, the Noah's Arc Circus troupe has captured audiences with their dazzling performances. Yet these fantastic acts don't come without a price. Children have mysteriously gone missing around London, correlating to that of the groups' movements. Unsettled by these kidnappings, Queen Victoria sends in her notorious guard dog, Ciel Phantomhive, and his ever-faithful demon butler, Sebastian Michaelis, on an undercover mission to find these missing children.

Trying to balance their new circus acts with their covert investigation under the big top, however, proves to be quite a challenge. With the other performers growing suspicious and the threat of the circus' mysterious benefactor looming overhead, what the two discover will shake Ciel to his very core.

"
"Kuroshitsuji: Book of Murder","8.29","Ranked #253","At the behest of the Queen, Earl Ciel Phantomhive hosts a lavish dinner party attended by several of the finest members of polite society—as well as struggling author, Arthur. But as the party reaches its high, a terrible murder takes place and none other than the Earl himself is suspected of the crime.

As a violent storm rages on outside, the death count continues to climb. The Phantomhive household and their eminent guests find they must cooperate in order to solve this mystery before they too fall prey to the mysterious murderer. However, it seems that not even the perfect butler, Sebastian Michaelis, is safe from this horror.

"
"Major: Message","8.29","Ranked #254","Thirteen years have passed. Following an injury that put Gorou's career as a pitcher into a standstill, he prepares to restart his baseball career as a fielder. His family struggles with his decisions, especially his daughter Izumi, who doesn't know enough about her father to understand why he is so absent from their lives. Gorou will stop at nothing until he's in the game once again; everything is now for the sake of the only gift he has to offer his children: Baseball. 
"
"One Piece Film: Z","8.29","Ranked #255","The Straw Hat Pirates enter the rough seas of the New World in search of the hidden treasures of the Pirate King, Gol D. Roger－One Piece. On their voyage, the pirates come across a terrifying, powerful man, former Marine Admiral Z.

Z is accused of having stolen the ""Dyna Stones"", weapons believed to have the power to shake up the New World. The Marine Headquarters believes Z is about to use it to end the pirate era, and with it, the lives of many innocent people. In fear of such a phenomenal event, marines start to take action against the former admiral.

Even if it means stumbling upon marines and the navy, the Straw Hat Pirates decided to chase after Z and stop him from causing havoc. As they continue to embark on their ventures, the pirates bump into new and familiar acquaintances."
"Sakurasou no Pet na Kanojo","8.29","Ranked #257","When abandoned kittens and his good conscience force second year Sorata Kanda to move into Suimei High School’s infamous Sakura Hall, the satellite dorm and its eccentric, misfit residents turn his life upside down. The decidedly average Sorata finds it difficult to fit in with the bizarre collection of dorm residents like Misaki, an energetic animator; Jin, a playwright playboy; Ryuunosuke, a reclusive programmer; and Chihiro, the dorm manager, art teacher, and party girl.

Sorata's friend Nanami, a second year student and aspiring voice actress, pushes him to find new owners for the many cats so that he can quickly move back into the regular dorms. However, his desire to escape Sakura Hall wavers when the pet-like and infantile second year Mashiro Shiina, a world-class artistic savant looking to become a mangaka, transfers in during the spring trimester and quickly latches onto him.

Supported by each other's quirks, Sorata and Mashiro come out of their shells and trigger change in the lives of those around them. Based on the light novel series of the same name, Sakurasou no Pet na Kanojo explores the fine threads connecting talent, hard work, romance, and friendship with its ensemble cast.

"
"Trigun","8.29","Ranked #258","Vash the Stampede is the man with a $$60,000,000,000 bounty on his head. The reason: he's a merciless villain who lays waste to all those that oppose him and flattens entire cities for fun, garnering him the title ""The Humanoid Typhoon."" He leaves a trail of death and destruction wherever he goes, and anyone can count themselves dead if they so much as make eye contact—or so the rumors say. In actuality, Vash is a huge softie who claims to have never taken a life and avoids violence at all costs.

With his crazy doughnut obsession and buffoonish attitude in tow, Vash traverses the wasteland of the planet Gunsmoke, all the while followed by two insurance agents, Meryl Stryfe and Milly Thompson, who attempt to minimize his impact on the public. But soon, their misadventures evolve into life-or-death situations as a group of legendary assassins are summoned to bring about suffering to the trio. Vash's agonizing past will be unraveled and his morality and principles pushed to the breaking point.

"
"Tsuki ga Kirei","8.29","Ranked #259","With a new school year comes a new crowd of classmates, and for their final year of junior high, aspiring writer Kotarou Azumi and track team member Akane Mizuno end up in the same class. Though initially complete strangers, a few chance encounters stir an innocent desire within their hearts. A yearning gaze, a fluttering heart—the hallmarks of young love slip into their lives as fate brings their paths to a cross.

However, though love is patient and love is kind, Kotarou and Akane discover it is not always straightforward. Despite the comfort they find in each other's company, heartache and anxiety come hand in hand with pursuing the feelings in their hearts. With the uncertainty of how the other truly feels as well as the competing affections of those around them, the road ahead is unclear. Even so, under the shining light of a beautiful full moon, Kotarou gathers his courage to ask Akane a single question, one that forever changes their quiet relationship.

"
"xxxHOLiC Kei","8.29","Ranked #260","Kimihiro Watanuki's life was never really normal. But in addition to his ability to see spirits, this sequel to xxxHOLiC finds him still slaving away for Yuuko, the bizarre owner of a strange shop, who promised to rid him of this ability. However, this otherworldly woman can only do so when he has worked enough to earn his wish. Such is the way for anyone who finds their way into the shop to have their request granted: a compensation equal to their wish must be paid. 

In this odd shop that straddles the world of the living and the dead, Watanuki finds himself doing household chores for the seemingly lazy Yuuko and her companions, while also helping out clients. Along with his classmates, supposed romantic rival Shizuka Doumeki and his crush Himawari Kunogi, Watanuki deals with the many misfortunes surrounding Yuuko's customers, as well as those that closely follow him and his friends.


"
"Yahari Ore no Seishun Love Comedy wa Machigatteiru. Zoku","8.29","Ranked #261","Yahari Ore no Seishun Love Comedy wa Machigatteiru. Zoku picks up immediately after the events of the first season, continuing the adventures of the Volunteer Service Club—the dispassionate Hachiman Hikigaya, the cheerful Yui Yuigahama, and the competitive Yukino Yukinoshita—as it dedicates itself to helping any student with issues that they may face.

With the rift among his own group widening, Hachiman begins to realize that his knack for quickly getting to the root of other people's troubles is a double-edged sword: sometimes the best solution is not necessarily the most appropriate one.

"
"Berserk: Ougon Jidai-hen III - Kourin","8.28","Ranked #262","The Band of the Hawk has dwindled in the year since Guts left them on his journey to forge his own destiny. Unaware of their fate, Guts returns to the Hawks—now being led by his former ally Casca—after a rumor about them passes his way. Once the saviors of the kingdom of Midland, the Band of the Hawk are now hunted as they desperately fight for their lives while plotting to free their leader, Griffith, after he was imprisoned for committing treason. But the man they save is far from the Griffith they remember.

Griffith is a shell of his former charismatic self after a year of continuous, horrific torture. No longer able to walk, speak, or even hold a sword, he has nothing but the small, strange trinket, the Crimson Behelit, that will not leave him. The entire Band of the Hawk want to rise to greatness once more, but how much are they willing to sacrifice to return to their past glory? It doesn't seem possible, but when Griffith's heart darkens and a solar eclipse blackens the sky, the Behelit offers a choice that will leave the Band of the Hawk with a blood-soaked fate that will haunt them for the rest of their days.

"
"Cardcaptor Sakura Movie 2: Fuuin Sareta Card","8.28","Ranked #263","During the Summer holidays, Sakura and her class are preparing to present a play at the annual Nadeshiko Festival. The unexpected arrival of Syaoran (and Meiling) give Sakura the courage to finally reciprocate her feelings. But as the cards begin to disappear one by one, Sakura discovers a single card still remains. One with power equal to all hers... It is during this summer that Sakura faces her final battle. "
